2012-2013,National Archives of Australia,TRUE,No data,"Regional Australia, Local Government, Arts and Sports",FALSE,19/07/2013 11:26,FALSE,0,2,2,1,1,0,0,0,0,1,1,1,1,0,5275,602,0,0,0,0,4455,0,0,0
2012-2013,National Capital Authority,TRUE,No data,"Regional Australia, Local Government, Arts and Sports",FALSE,3/07/2013 14:49,FALSE,0,11,250,5,75,45,0,0,0,3,25,0,5,0,500,50,0,0,0,0,0,0,200,0
2012-2013,National Film and Sound Archive of Australia,TRUE,No data,"Regional Australia, Local Government, Arts and Sports",FALSE,24/07/2013 18:16,FALSE,0,1,24,0,0,0,0,0,0,4,50,10,30,3,100,100,1000,0,0,0,0,0,0,0
2012-2013,National Gallery of Australia,TRUE,No data,"Regional Australia, Local Government, Arts and Sports",FALSE,6/08/2013 10:57,FALSE,0,3,35,10,0,0,0,0,0,1,5,1,0,0,0,0,2300,0,0,0,0,0,0,0
2012-2013,National Library of Australia,TRUE,No data,"Regional Australia, Local Government, Arts and Sports",FALSE,18/07/2013 14:11,FALSE,0,6,16,1,0,0,0,0,0,1,1,0,0,0,0,0,0,0,0,0,0,0,0,0
2012-2013,National Museum of Australia,TRUE,No data,"Regional Australia, Local Government, Arts and Sports",FALSE,27/06/2013 11:46,FALSE,0,10,107,9,25,23,0,0,0,6,0,0,78,96,0,0,10650,0,0,0,890,0,0,0
2012-2013,Public Lending Right Committee,TRUE,"Department of Regional Australia, Local Government, Arts and Sport","Regional Australia, Local Government, Arts and Sports",TRUE,31/07/2013 10:07,FALSE,0,0,0,0,0,0,0,0,0,0,0,0,0,0,0,0,0,0,0,0,0,0,0,0
2012-2013,Screen Australia,TRUE,No data,"Regional Australia, Local Government, Arts and Sports",FALSE,10/07/2013 17:20,FALSE,0,3,6,6,0,0,0,0,0,2,1,0,0,0,0,0,0,0,0,0,0,0,0,0
2012-2013,Sport and Recreation Ministers' Council,TRUE,"Department of Regional Australia, Local Government, Arts and Sport","Regional Australia, Local Government, Arts and Sports",TRUE,31/07/2013 10:08,FALSE,0,0,0,0,0,0,0,0,0,0,0,0,0,0,0,0,0,0,0,0,0,0,0,0
2012-2013,Australian Renewable Energy Agency,TRUE,"Department of Resources, Energy and Tourism","Resources, Energy and Tourism",TRUE,2/08/2013 17:17,FALSE,0,0,0,0,0,0,0,0,0,0,0,0,0,0,0,0,0,0,0,0,0,0,0,0
2012-2013,"Department of Resources, Energy and Tourism",TRUE,"Department of Resources, Energy and Tourism","Resources, Energy and Tourism",FALSE,31/07/2013 14:32,FALSE,1,39,5900,152,760,0,38,0,0,2,200,0,0,0,1850,0,0,0,0,0,0,0,0,0
2012-2013,Geoscience Australia,TRUE,"Department of Resources, Energy and Tourism","Resources, Energy and Tourism",FALSE,6/08/2013 18:10,FALSE,0,3,400,0,30,4,0,0,0,2,100,8,0,0,150,50,0,0,0,0,1780,0,0,0
2012-2013,Minister for Resources and Energy,TRUE,"Department of Resources, Energy and Tourism","Resources, Energy and Tourism",TRUE,6/08/2013 18:19,FALSE,0,0,0,0,0,0,0,0,0,0,0,0,0,0,0,0,0,0,0,0,0,0,0,0
2012-2013,Minister for Tourism,TRUE,"Department of Resources, Energy and Tourism","Resources, Energy and Tourism",TRUE,6/08/2013 18:17,FALSE,0,0,0,0,0,0,0,0,0,0,0,0,0,0,0,0,0,0,0,0,0,0,0,0
2012-2013,National Offshore Petroleum Safety & Environmental Management Auth.,TRUE,No data,"Resources, Energy and Tourism",FALSE,3/07/2013 17:33,FALSE,0,5,465,0,40,0,0,0,0,2,30,0,0,0,40,0,0,0,13500,0,0,0,0,0
2012-2013,Offshore Minerals Joint Authority,TRUE,"Department of Resources, Energy and Tourism","Resources, Energy and Tourism",TRUE,6/08/2013 18:18,FALSE,0,0,0,0,0,0,0,0,0,0,0,0,0,0,0,0,0,0,0,0,0,0,0,0
2012-2013,Tourism Australia,TRUE,No data,"Resources, Energy and Tourism",TRUE,4/07/2013 11:22,FALSE,0,0,0,0,0,0,0,0,0,0,0,0,0,0,0,0,0,0,0,0,0,0,0,0
2012-2013,Australian Heritage Council,TRUE,"Department of Sustainability, Environment, Water, Population and Communities","Sustainability, Environment, Water, Population and Communities",TRUE,23/07/2013 16:36,FALSE,0,0,0,0,0,0,0,0,0,0,0,0,0,0,0,0,0,0,0,0,0,0,0,0
2012-2013,Bureau of Meteorology,TRUE,No data,"Sustainability, Environment, Water, Population and Communities",FALSE,7/08/2013 10:51,FALSE,0,69,548,73,321,5,0,0,0,1,5,0,0,2,55759,431,10989,0,0,0,2500,0,0,0
2012-2013,Commonwealth Environmental Water Holder,TRUE,"Department of Sustainability, Environment, Water, Population and Communities","Sustainability, Environment, Water, Population and Communities",TRUE,23/07/2013 16:36,FALSE,0,0,0,0,0,0,0,0,0,0,0,0,0,0,0,0,0,0,0,0,0,0,0,0
2012-2013,"Dept of Sustainability, Environment, Water, Population and Communities",TRUE,"Department of Sustainability, Environment, Water, Population and Communities","Sustainability, Environment, Water, Population and Communities",FALSE,2/11/2012 11:11,FALSE,1,4,3000,363,1170,341,2,0,1,2,300,208,520,0,1160,100,32223,0,0,0,0,0,0,0
2012-2013,Director of National Parks,TRUE,"Department of Sustainability, Environment, Water, Population and Communities","Sustainability, Environment, Water, Population and Communities",FALSE,25/07/2013 13:35,FALSE,0,1,1,3,26,0,0,0,0,1,1,0,0,0,30,0,0,0,0,0,0,0,0,0
2012-2013,Great Barrier Reef Marine Park Authority,TRUE,No data,"Sustainability, Environment, Water, Population and Communities",FALSE,25/06/2013 11:47,FALSE,2,56,428,5,98,98,0,0,0,2,200,0,5,0,25839,0,0,0,0,0,0,0,0,0
2012-2013,"Min for Sustainability, Environment, Water, Population and Communities",TRUE,"Department of Sustainability, Environment, Water, Population and Communities","Sustainability, Environment, Water, Population and Communities",FALSE,25/07/2013 13:37,FALSE,0,1,0,0,0,0,3,0,0,0,0,0,0,0,0,0,0,0,0,0,0,0,0,0
2012-2013,Murray-Darling Basin Authority,TRUE,No data,"Sustainability, Environment, Water, Population and Communities",FALSE,15/07/2013 9:35,FALSE,0,29,169,29,231,0,0,0,0,8,3,0,1268,0,332,0,0,0,0,0,0,0,0,0
2012-2013,National Environment Protection Council,TRUE,"Department of Sustainability, Environment, Water, Population and Communities","Sustainability, Environment, Water, Population and Communities",TRUE,5/08/2013 8:28,FALSE,0,0,0,0,0,0,0,0,0,0,0,0,0,0,0,0,0,0,0,0,0,0,0,0
2012-2013,National Environment Protection Council Service Corporation,TRUE,"Department of Sustainability, Environment, Water, Population and Communities","Sustainability, Environment, Water, Population and Communities",TRUE,23/07/2013 16:36,FALSE,0,0,0,0,0,0,0,0,0,0,0,0,0,0,0,0,0,0,0,0,0,0,0,0
2012-2013,National Water Commission,TRUE,No data,"Sustainability, Environment, Water, Population and Communities",TRUE,9/07/2013 13:54,FALSE,0,0,0,0,0,0,0,0,0,0,0,0,0,0,0,0,0,0,0,0,0,0,0,0
2012-2013,Parliamentary Secretary for Sustainability and Urban Water,TRUE,"Department of Sustainability, Environment, Water, Population and Communities","Sustainability, Environment, Water, Population and Communities",TRUE,23/07/2013 16:35,FALSE,0,0,0,0,0,0,0,0,0,0,0,0,0,0,0,0,0,0,0,0,0,0,0,0
2012-2013,Sydney Harbour Federation Trust,TRUE,No data,"Sustainability, Environment, Water, Population and Communities",FALSE,5/08/2013 9:49,FALSE,0,2,0,0,25,0,0,0,0,2,0,0,20,0,0,0,3531,0,0,0,0,0,0,0
2012-2013,Water Efficiency Labelling and Standards Regulator,TRUE,"Department of Sustainability, Environment, Water, Population and Communities","Sustainability, Environment, Water, Population and Communities",TRUE,23/07/2013 16:35,FALSE,0,0,0,0,0,0,0,0,0,0,0,0,0,0,0,0,0,0,0,0,0,0,0,0
2012-2013,The Administration of Norfolk Island,TRUE,No data,The Administration of Norfolk Island,FALSE,6/08/2013 7:26,FALSE,0,1,2,0,0,0,0,0,0,2,2,0,0,0,600,100,0,0,0,0,0,0,0,0
2012-2013,Assistant Treasurer,TRUE,Department of the Treasury,Treasury,FALSE,5/07/2013 9:20,FALSE,2,0,40,22,11,11,0,0,0,0,0,0,0,0,0,0,0,0,0,0,0,0,0,0
2012-2013,Auditing and Assurance Standards Board,TRUE,No data,Treasury,TRUE,15/07/2013 8:49,FALSE,0,0,0,0,0,0,0,0,0,0,0,0,0,0,0,0,0,0,0,0,0,0,0,0
2012-2013,Australian Accounting Standards Board,TRUE,No data,Treasury,FALSE,5/08/2013 9:26,FALSE,0,2,1,0,1,0,0,0,0,0,0,0,0,0,0,0,0,0,0,0,0,0,0,0
2012-2013,Australian Bureau of Statistics,TRUE,Australian Bureau of Statistics,Treasury,FALSE,16/11/2012 9:31,FALSE,0,1,288,32,67,16,0,0,0,0,10,0,0,0,0,0,0,0,0,0,1400,0,0,0
2012-2013,Australian Charities and Not-for-Profits Commission,TRUE,No data,Treasury,FALSE,18/07/2013 13:33,FALSE,0,7,50,0,30,0,0,0,0,7,25,0,30,0,0,0,0,0,0,0,3000,0,0,0
2012-2013,Australian Competition and Consumer Commission,TRUE,Australian Competition and Consumer Commission,Treasury,FALSE,11/07/2013 15:51,FALSE,2,21,0,39,3035,1534,0,0,0,2,0,0,1,6,22692,0,26728,0,0,0,6300,0,0,0
2012-2013,Australian Competition Tribunal,TRUE,No data,Treasury,TRUE,5/08/2013 10:08,FALSE,0,0,0,0,0,0,0,0,0,0,0,0,0,0,0,0,0,0,0,0,0,0,0,0
2012-2013,Australian Energy Regulator,TRUE,Australian Competition and Consumer Commission,Treasury,TRUE,1/07/2013 15:23,FALSE,0,0,0,0,0,0,0,0,0,0,0,0,0,0,0,0,0,0,0,0,0,0,0,0
2012-2013,Australian Prudential Regulation Authority,TRUE,No data,Treasury,FALSE,19/07/2013 11:33,FALSE,0,14,393,23,50,35,0,0,0,2,8,0,0,0,0,0,0,0,0,0,12723,0,0,0
2012-2013,Australian Reinsurance Pool Corporation,TRUE,Department of the Treasury,Treasury,TRUE,5/07/2013 9:21,FALSE,0,0,0,0,0,0,0,0,0,0,0,0,0,0,0,0,0,0,0,0,0,0,0,0
2012-2013,Australian Securities and Investments Commission,TRUE,No data,Treasury,FALSE,9/07/2013 12:11,FALSE,2,89,2261,50,3260,77,0,0,0,3,0,0,205,7,0,0,0,0,0,0,0,0,0,0
2012-2013,Australian Statistics Advisory Council,TRUE,Australian Bureau of Statistics,Treasury,TRUE,19/07/2013 15:10,FALSE,0,0,0,0,0,0,0,0,0,0,0,0,0,0,0,0,0,0,0,0,0,0,0,0
2012-2013,Australian Taxation Office,TRUE,No data,Treasury,FALSE,19/07/2013 11:47,FALSE,31,50,62000,100,25000,7000,0,0,3,0,7500,120,1300,0,45908,0,1559513,0,562437,0,5803,0,0,57300
2012-2013,Clean Energy Finance Corporation,TRUE,No data,Treasury,FALSE,15/07/2013 12:20,FALSE,0,7,124,7,0,0,0,0,0,3,19,4,0,0,200,0,7500,0,0,0,420,0,0,0
2012-2013,Commonwealth Grants Commission,TRUE,No data,Treasury,FALSE,2/07/2013 11:17,FALSE,0,1,1,0,0,0,0,0,0,0,0,0,0,0,0,0,0,0,0,0,0,0,0,0
2012-2013,Companies Auditors and Liquidators Disciplinary Board,TRUE,Department of the Treasury,Treasury,TRUE,4/06/2013 9:03,FALSE,0,0,0,0,0,0,0,0,0,0,0,0,0,0,0,0,0,0,0,0,0,0,0,0
2012-2013,Corporations and Markets Advisory Committee,TRUE,No data,Treasury,TRUE,17/07/2013 16:54,FALSE,0,0,0,0,0,0,0,0,0,0,0,0,0,0,0,0,0,0,0,0,0,0,0,0
2012-2013,Department of the Treasury,TRUE,Department of the Treasury,Treasury,FALSE,5/07/2013 9:21,FALSE,3,0,4050,920,806,114,96,0,0,0,0,0,0,0,0,0,0,0,0,0,890,0,0,0
2012-2013,Financial Reporting Council,TRUE,Department of the Treasury,Treasury,TRUE,5/07/2013 9:20,FALSE,0,0,0,0,0,0,0,0,0,0,0,0,0,0,0,0,0,0,0,0,0,0,0,0
2012-2013,Financial Reporting Panel,TRUE,Department of the Treasury,Treasury,TRUE,5/07/2013 9:21,FALSE,0,0,0,0,0,0,0,0,0,0,0,0,0,0,0,0,0,0,0,0,0,0,0,0
2012-2013,Inspector-General of Taxation,TRUE,No data,Treasury,TRUE,31/07/2013 17:13,FALSE,0,0,0,0,0,0,0,0,0,0,0,0,0,0,0,0,0,0,0,0,0,0,0,0
2012-2013,Minister for Financial Services and Superannuation,TRUE,No data,Treasury,FALSE,5/07/2013 9:20,FALSE,2,1,195,23,93,0,0,0,0,0,0,0,0,0,0,0,0,0,0,0,0,0,0,0
2012-2013,National Competition Council,TRUE,No data,Treasury,TRUE,8/07/2013 10:03,FALSE,0,0,0,0,0,0,0,0,0,0,0,0,0,0,0,0,0,0,0,0,0,0,0,0
2012-2013,Parliamentary Secretary to the Treasurer,TRUE,Department of the Treasury,Treasury,TRUE,5/07/2013 9:21,FALSE,0,0,0,0,0,0,0,0,0,0,0,0,0,0,0,0,0,0,0,0,0,0,0,0
2012-2013,Productivity Commission,TRUE,No data,Treasury,FALSE,25/07/2013 13:31,FALSE,0,2,4,0,0,0,0,0,0,2,1,0,0,0,0,0,0,0,0,0,0,0,0,0
2012-2013,Reserve Bank of Australia,TRUE,No data,Treasury,FALSE,25/07/2013 13:00,FALSE,0,22,264,45,67,6,13,0,0,8,17,2,0,0,0,0,0,0,0,0,0,0,0,0
2012-2013,Superannuation Complaints Tribunal,TRUE,No data,Treasury,FALSE,18/07/2013 10:38,FALSE,0,3,105,4,0,0,0,0,0,4,2,0,0,0,350,0,0,0,0,0,0,0,0,0
2012-2013,Takeovers Panel,TRUE,Department of the Treasury,Treasury,FALSE,5/07/2013 9:21,FALSE,2,0,30,43,0,0,0,0,0,0,0,0,0,0,0,0,0,0,0,0,0,0,0,0
2012-2013,Tax Practitioners Board,TRUE,No data,Treasury,FALSE,3/04/2013 16:28,FALSE,1,5,1600,10,800,20,0,0,0,3,50,10,50,20,0,0,40442,0,0,0,640,0,0,0
2012-2013,Treasurer,TRUE,Department of the Treasury,Treasury,FALSE,5/07/2013 9:21,FALSE,3,1,90,15,7,8,0,0,0,0,0,0,0,0,0,0,0,0,0,0,0,0,0,0
2012-2013,Australian War Memorial,TRUE,No data,Veterans' Affairs,FALSE,1/08/2013 8:30,FALSE,0,1,1,1,2,0,0,0,0,1,1,1,3,1,0,0,0,0,0,0,0,0,0,0
2012-2013,Department of Veterans' Affairs,TRUE,Department of Veterans' Affairs,Veterans' Affairs,FALSE,18/10/2012 9:32,FALSE,9,18,15000,70,90,13000,3,18,0,2,20,0,2,50,34500,0,0,0,0,0,0,0,0,0
2012-2013,Military Rehabilitation and Compensation Commission,TRUE,Department of Veterans' Affairs,Veterans' Affairs,TRUE,2/08/2013 17:09,FALSE,0,0,0,0,0,0,0,0,0,0,0,0,0,0,0,0,0,0,0,0,0,0,0,0
2012-2013,Minister for Veterans' Affairs,TRUE,Department of Veterans' Affairs,Veterans' Affairs,FALSE,2/08/2013 17:12,FALSE,0,1,0,0,0,0,1,1,0,0,0,0,0,0,0,0,0,0,0,0,0,0,0,0
2012-2013,Repatriation Commission,TRUE,Department of Veterans' Affairs,Veterans' Affairs,TRUE,2/08/2013 17:11,FALSE,0,0,0,0,0,0,0,0,0,0,0,0,0,0,0,0,0,0,0,0,0,0,0,0
2012-2013,Repatriation Medical Authority,TRUE,No data,Veterans' Affairs,FALSE,31/07/2013 14:47,FALSE,0,1,120,0,30,0,0,0,0,2,10,0,0,0,2000,1000,15000,1000,0,0,0,0,0,0
2012-2013,Specialist Medical Review Council,TRUE,No data,Veterans' Affairs,TRUE,3/07/2013 14:30,FALSE,0,0,0,0,0,0,0,0,0,0,0,0,0,0,0,0,0,0,0,0,0,0,0,0
2012-2013,Veterans' Review Board,TRUE,No data,Veterans' Affairs,FALSE,23/07/2013 14:49,FALSE,0,3,14,0,1,0,0,0,0,3,19,0,1,0,0,0,0,0,0,0,0,0,0,0
