2012-2013,Australian Agency for International Development (AusAID),TRUE,No data,Foreign Affairs and Trade,FALSE,24/06/2013 15:52,FALSE,0,3,1432,80,210,32,0,0,1,35,800,24,36,24,100,0,2298,0,0,0,1780,0,0,0
2012-2013,Australian Centre for International Agricultural Research,TRUE,No data,Foreign Affairs and Trade,TRUE,5/08/2013 8:56,FALSE,0,0,0,0,0,0,0,0,0,0,0,0,0,0,0,0,0,0,0,0,0,0,0,0
2012-2013,Australian Trade Commission (Austrade),TRUE,No data,Foreign Affairs and Trade,FALSE,7/08/2013 11:49,FALSE,1,2,130,35,125,167,0,0,0,1,75,15,45,85,55000,15000,85000,20000,0,0,500,500,0,0
2012-2013,Department of Foreign Affairs and Trade,TRUE,Department of Foreign Affairs and Trade,Foreign Affairs and Trade,FALSE,15/11/2012 15:28,FALSE,8,1,10600,2100,880,0,40,40,0,2,240,150,300,0,8600,0,1000,0,0,0,0,0,0,0
2012-2013,Export Finance and Insurance Corporation,TRUE,No data,Foreign Affairs and Trade,TRUE,30/07/2013 10:57,FALSE,0,0,0,0,0,0,0,0,0,0,0,0,0,0,0,0,0,0,0,0,0,0,0,0
2012-2013,Minister for Foreign Affairs,TRUE,Department of Foreign Affairs and Trade,Foreign Affairs and Trade,FALSE,11/07/2013 12:44,FALSE,2,2,0,0,0,0,1,1,0,0,0,0,0,0,0,0,0,0,0,0,0,0,0,0
2012-2013,Minister for Trade and Competitiveness,TRUE,Department of Foreign Affairs and Trade,Foreign Affairs and Trade,TRUE,11/07/2013 12:42,FALSE,0,0,0,0,0,0,0,0,0,0,0,0,0,0,0,0,0,0,0,0,0,0,0,0
2012-2013,Parliamentary Secretary for Foreign Affairs,TRUE,Department of Foreign Affairs and Trade,Foreign Affairs and Trade,TRUE,11/07/2013 12:46,FALSE,0,0,0,0,0,0,0,0,0,0,0,0,0,0,0,0,0,0,0,0,0,0,0,0
2012-2013,Parliamentary Secretary for Pacific Island Affairs,TRUE,Department of Foreign Affairs and Trade,Foreign Affairs and Trade,TRUE,11/07/2013 12:44,FALSE,0,0,0,0,0,0,0,0,0,0,0,0,0,0,0,0,0,0,0,0,0,0,0,0
2012-2013,Parliamentary Secretary for Trade,TRUE,Department of Foreign Affairs and Trade,Foreign Affairs and Trade,TRUE,11/07/2013 12:43,FALSE,0,0,0,0,0,0,0,0,0,0,0,0,0,0,0,0,0,0,0,0,0,0,0,0
2012-2013,Advisory Committee on Biologicals,TRUE,Department of Health and Ageing,Health and Ageing,TRUE,5/07/2013 11:39,FALSE,0,0,0,0,0,0,0,0,0,0,0,0,0,0,0,0,0,0,0,0,0,0,0,0
2012-2013,Advisory Committee on Chemicals Scheduling ,TRUE,Department of Health and Ageing,Health and Ageing,TRUE,5/07/2013 11:35,FALSE,0,0,0,0,0,0,0,0,0,0,0,0,0,0,0,0,0,0,0,0,0,0,0,0
2012-2013,Advisory Committee on Complementary Medicines,TRUE,Department of Health and Ageing,Health and Ageing,TRUE,5/07/2013 11:30,FALSE,0,0,0,0,0,0,0,0,0,0,0,0,0,0,0,0,0,0,0,0,0,0,0,0
2012-2013,Advisory Committee on Medical Devices ,TRUE,Department of Health and Ageing,Health and Ageing,TRUE,5/07/2013 11:32,FALSE,0,0,0,0,0,0,0,0,0,0,0,0,0,0,0,0,0,0,0,0,0,0,0,0
2012-2013,Advisory Committee on Medicines Scheduling ,TRUE,Department of Health and Ageing,Health and Ageing,TRUE,5/07/2013 11:33,FALSE,0,0,0,0,0,0,0,0,0,0,0,0,0,0,0,0,0,0,0,0,0,0,0,0
2012-2013,Advisory Committee on Non-prescription Medicines ,TRUE,Department of Health and Ageing,Health and Ageing,TRUE,5/07/2013 11:32,FALSE,0,0,0,0,0,0,0,0,0,0,0,0,0,0,0,0,0,0,0,0,0,0,0,0
2012-2013,Advisory Committee on Prescription Medicines,TRUE,Department of Health and Ageing,Health and Ageing,TRUE,5/07/2013 11:31,FALSE,0,0,0,0,0,0,0,0,0,0,0,0,0,0,0,0,0,0,0,0,0,0,0,0
2012-2013,Advisory Committee on the Safety of Medical Devices,TRUE,Department of Health and Ageing,Health and Ageing,TRUE,5/07/2013 11:39,FALSE,0,0,0,0,0,0,0,0,0,0,0,0,0,0,0,0,0,0,0,0,0,0,0,0
2012-2013,Advisory Committee on the Safety of Medicines,TRUE,Department of Health and Ageing,Health and Ageing,TRUE,5/07/2013 11:38,FALSE,0,0,0,0,0,0,0,0,0,0,0,0,0,0,0,0,0,0,0,0,0,0,0,0
2012-2013,Aged Care Commissioner,TRUE,No data,Health and Ageing,FALSE,30/04/2013 15:24,FALSE,0,2,8,0,12,0,0,0,0,2,5,0,1,0,2,0,4743,211,0,0,0,0,0,0
2012-2013,Australian Commission on Safety and Quality in Health Care,TRUE,Australian Commission on Safety and Quality in Health Care,Health and Ageing,FALSE,5/07/2013 14:50,FALSE,0,1,20,0,4,0,0,0,0,1,5,0,1,0,0,0,2352,0,0,0,0,0,0,0
2012-2013,Australian Commission on Safety and Quality in Healthcare Board,TRUE,Australian Commission on Safety and Quality in Health Care,Health and Ageing,TRUE,31/07/2013 17:15,FALSE,0,0,0,0,0,0,0,0,0,0,0,0,0,0,0,0,0,0,0,0,0,0,0,0
2012-2013,Australian Community Pharmacy Authority,TRUE,Department of Health and Ageing,Health and Ageing,TRUE,5/07/2013 11:21,FALSE,0,0,0,0,0,0,0,0,0,0,0,0,0,0,0,0,0,0,0,0,0,0,0,0
2012-2013,Australian Institute of Health and Welfare,TRUE,No data,Health and Ageing,FALSE,5/08/2013 9:23,FALSE,0,0,40,10,5,0,0,0,0,0,0,0,0,0,0,0,0,0,0,0,0,0,0,0
2012-2013,Australian National Preventive Health Agency,TRUE,Department of Health and Ageing,Health and Ageing,FALSE,5/07/2013 11:41,FALSE,0,1,20,20,0,0,0,0,0,0,0,0,0,0,0,0,0,0,0,0,0,0,0,0
2012-2013,Australian Organ and Tissue Donation and Transplantation Authority,TRUE,No data,Health and Ageing,FALSE,1/07/2013 14:43,FALSE,0,1,10,2,5,0,0,0,0,1,10,2,0,0,0,0,0,0,0,0,0,0,0,0
2012-2013,Australian Radiation Protection and Nuclear Safety Agency,TRUE,No data,Health and Ageing,FALSE,2/08/2013 14:33,FALSE,0,7,2,0,5,0,0,0,0,0,0,0,0,0,0,0,0,0,0,0,890,0,0,0
2012-2013,Cancer Australia,TRUE,No data,Health and Ageing,TRUE,1/08/2013 11:04,FALSE,0,0,0,0,0,0,0,0,0,0,0,0,0,0,0,0,0,0,0,0,0,0,0,0
2012-2013,Complaints Resolution Panel (Therapeutic good advertising),TRUE,Department of Health and Ageing,Health and Ageing,TRUE,5/07/2013 11:27,FALSE,0,0,0,0,0,0,0,0,0,0,0,0,0,0,0,0,0,0,0,0,0,0,0,0
2012-2013,Department of Health and Ageing,TRUE,Department of Health and Ageing,Health and Ageing,FALSE,20/03/2013 10:45,FALSE,5,4,10000,223,494,49,0,0,1,0,1000,0,0,0,10488,0,55315,0,0,0,9171,0,4360,0
2012-2013,Food Standards Australia New Zealand,TRUE,No data,Health and Ageing,FALSE,2/07/2013 16:07,FALSE,0,130,761,35,515,30,0,0,0,4,310,0,0,0,5500,0,3828,0,0,0,2593,0,0,0
2012-2013,Gene Technology Ethics & Community Consultative Committee,TRUE,Department of Health and Ageing,Health and Ageing,TRUE,5/07/2013 11:26,FALSE,0,0,0,0,0,0,0,0,0,0,0,0,0,0,0,0,0,0,0,0,0,0,0,0
2012-2013,Gene Technology Ministerial Council,TRUE,Department of Health and Ageing,Health and Ageing,TRUE,5/07/2013 11:20,FALSE,0,0,0,0,0,0,0,0,0,0,0,0,0,0,0,0,0,0,0,0,0,0,0,0
2012-2013,Gene Technology Regulator,TRUE,Department of Health and Ageing,Health and Ageing,TRUE,5/07/2013 11:21,FALSE,0,0,0,0,0,0,0,0,0,0,0,0,0,0,0,0,0,0,0,0,0,0,0,0
2012-2013,Gene Technology Technical Advisory Committee,TRUE,Department of Health and Ageing,Health and Ageing,TRUE,5/07/2013 11:26,FALSE,0,0,0,0,0,0,0,0,0,0,0,0,0,0,0,0,0,0,0,0,0,0,0,0
2012-2013,Health and Hospitals Fund Advisory Board,TRUE,Department of Health and Ageing,Health and Ageing,TRUE,5/07/2013 11:38,FALSE,0,0,0,0,0,0,0,0,0,0,0,0,0,0,0,0,0,0,0,0,0,0,0,0
2012-2013,Health Workforce Australia,TRUE,No data,Health and Ageing,FALSE,2/08/2013 15:39,FALSE,0,1,30,0,0,0,0,0,0,1,15,0,0,0,0,0,0,0,0,0,250,0,0,0
2012-2013,Independent Hospital Pricing Authority,TRUE,No data,Health and Ageing,TRUE,5/07/2013 11:40,FALSE,0,0,0,0,0,0,0,0,0,0,0,0,0,0,0,0,0,0,0,0,0,0,0,0
2012-2013,Independent Review PBS Cost Recovery Committee,TRUE,Department of Health and Ageing,Health and Ageing,TRUE,5/07/2013 11:37,FALSE,0,0,0,0,0,0,0,0,0,0,0,0,0,0,0,0,0,0,0,0,0,0,0,0
2012-2013,Medical Training Review Panel,TRUE,Department of Health and Ageing,Health and Ageing,TRUE,5/07/2013 11:29,FALSE,0,0,0,0,0,0,0,0,0,0,0,0,0,0,0,0,0,0,0,0,0,0,0,0
2012-2013,Medicare Participation Review Committee,TRUE,Department of Health and Ageing,Health and Ageing,TRUE,5/07/2013 11:24,FALSE,0,0,0,0,0,0,0,0,0,0,0,0,0,0,0,0,0,0,0,0,0,0,0,0
2012-2013,Minister for Health and Medical Research,TRUE,Department of Health and Ageing,Health and Ageing,TRUE,5/07/2013 11:35,FALSE,0,0,0,0,0,0,0,0,0,0,0,0,0,0,0,0,0,0,0,0,0,0,0,0
2012-2013,Minister for Indigenous Health,TRUE,Department of Health and Ageing,Health and Ageing,TRUE,5/08/2013 9:17,FALSE,0,0,0,0,0,0,0,0,0,0,0,0,0,0,0,0,0,0,0,0,0,0,0,0
2012-2013,Minister for Mental Health and Ageing,TRUE,Department of Health and Ageing,Health and Ageing,TRUE,5/07/2013 11:25,FALSE,0,0,0,0,0,0,0,0,0,0,0,0,0,0,0,0,0,0,0,0,0,0,0,0
2012-2013,National Blood Authority,TRUE,No data,Health and Ageing,FALSE,7/11/2012 11:38,FALSE,0,2,2,2,0,0,0,0,0,1,1,0,1,0,0,0,0,0,0,0,0,0,0,0
2012-2013,National Health and Medical Research Council,TRUE,No data,Health and Ageing,FALSE,15/01/2013 12:11,FALSE,0,24,24,234,350,35,0,0,0,3,3,0,75,60,2788,1200,6394,0,0,0,0,0,0,0
2012-2013,National Health Performance Authority ,TRUE,Department of Health and Ageing,Health and Ageing,TRUE,5/07/2013 11:40,FALSE,0,0,0,0,0,0,0,0,0,0,0,0,0,0,0,0,0,0,0,0,0,0,0,0
2012-2013,National Industrial Chemicals Notification and Assessment Scheme,TRUE,No data,Health and Ageing,FALSE,5/08/2013 7:53,FALSE,0,1,1,1,0,0,0,0,0,2,2,0,0,0,0,0,0,0,0,0,0,0,0,0
2012-2013,Parliamentary Secretary for Health and Ageing,TRUE,Department of Health and Ageing,Health and Ageing,FALSE,2/08/2013 9:37,FALSE,5,4,10000,223,494,49,0,0,1,0,1000,0,0,0,10488,0,55315,0,0,0,9171,0,4360,0
2012-2013,Pathology Services Table Committee,TRUE,Department of Health and Ageing,Health and Ageing,TRUE,5/07/2013 11:36,FALSE,0,0,0,0,0,0,0,0,0,0,0,0,0,0,0,0,0,0,0,0,0,0,0,0
2012-2013,Pharmaceutical Benefits Advisory Committee,TRUE,Department of Health and Ageing,Health and Ageing,TRUE,5/07/2013 11:22,FALSE,0,0,0,0,0,0,0,0,0,0,0,0,0,0,0,0,0,0,0,0,0,0,0,0
2012-2013,Pharmaceutical Benefits Remuneration Tribunal,TRUE,Department of Health and Ageing,Health and Ageing,TRUE,5/07/2013 11:23,FALSE,0,0,0,0,0,0,0,0,0,0,0,0,0,0,0,0,0,0,0,0,0,0,0,0
2012-2013,Private Health Insurance Administration Council,TRUE,No data,Health and Ageing,FALSE,19/07/2013 16:03,FALSE,0,1,0,0,8,4,0,0,0,1,0,0,0,0,0,0,0,0,0,0,0,0,0,0
2012-2013,Private Health Insurance Ombudsman,TRUE,No data,Health and Ageing,FALSE,21/06/2013 15:58,FALSE,0,5,28,2,0,5,0,0,0,2,5,0,0,0,2173,310,6525,0,0,0,0,0,0,0
2012-2013,Professional Services Review,TRUE,No data,Health and Ageing,TRUE,5/08/2013 11:20,FALSE,0,0,0,0,0,0,0,0,0,0,0,0,0,0,0,0,0,0,0,0,0,0,0,0
2012-2013,Prostheses List Advisory Committee,TRUE,Department of Health and Ageing,Health and Ageing,TRUE,5/07/2013 11:36,FALSE,0,0,0,0,0,0,0,0,0,0,0,0,0,0,0,0,0,0,0,0,0,0,0,0
2012-2013,Second Review Dental Benefits Act 2008 Committee,TRUE,Department of Health and Ageing,Health and Ageing,TRUE,5/07/2013 11:38,FALSE,0,0,0,0,0,0,0,0,0,0,0,0,0,0,0,0,0,0,0,0,0,0,0,0
2012-2013,Therapeutic Goods Advertising Code Council,TRUE,Department of Health and Ageing,Health and Ageing,TRUE,5/07/2013 11:23,FALSE,0,0,0,0,0,0,0,0,0,0,0,0,0,0,0,0,0,0,0,0,0,0,0,0
2012-2013,Therapeutic Goods Committee,TRUE,Department of Health and Ageing,Health and Ageing,TRUE,5/07/2013 11:23,FALSE,0,0,0,0,0,0,0,0,0,0,0,0,0,0,0,0,0,0,0,0,0,0,0,0
2012-2013,Australian Hearing,TRUE,No data,Human Services,FALSE,19/07/2013 13:26,FALSE,0,2,110,2,0,0,0,0,0,2,0,0,0,0,0,0,21904,0,0,0,0,0,0,0
2012-2013,Department of Human Services,TRUE,Department of Human Services,Human Services,FALSE,15/10/2012 7:51,FALSE,32,1008,62500,181,4178,8522,0,0,1,12,1500,128,2272,0,92387,0,346669,0,22994,0,21490,0,0,0
2012-2013,Minister for Human Services,TRUE,Department of Human Services,Human Services,TRUE,31/07/2013 13:30,FALSE,0,0,0,0,0,0,0,0,0,0,0,0,0,0,0,0,0,0,0,0,0,0,0,0
2012-2013,Department of Immigration and Citizenship,TRUE,Department of Immigration and Citizenship,Immigration and Citizenship,FALSE,31/07/2013 16:41,FALSE,72,30,136170,90,450,0,0,0,0,3,1800,0,0,0,605313,0,4640,0,52291,0,40352,0,53300,0
2012-2013,Migration Review Tribunal,TRUE,Migration Review Tribunal,Immigration and Citizenship,FALSE,8/11/2012 15:05,FALSE,0,80,630,0,30,20,0,0,0,1,0,0,2,0,4790,0,0,0,0,0,0,0,365,0
2012-2013,Minister for Immigration and Citizenship,TRUE,Department of Immigration and Citizenship,Immigration and Citizenship,FALSE,31/07/2013 17:00,FALSE,0,5,0,0,0,0,0,20,0,0,0,0,0,0,0,0,0,0,0,0,0,0,0,0
2012-2013,Minister for Multicultural Affairs,TRUE,Department of Immigration and Citizenship,Immigration and Citizenship,TRUE,31/07/2013 17:04,FALSE,0,0,0,0,0,0,0,0,0,0,0,0,0,0,0,0,0,0,0,0,0,0,0,0
2012-2013,Refugee Review Tribunal,TRUE,Migration Review Tribunal,Immigration and Citizenship,FALSE,21/06/2013 13:36,FALSE,0,80,620,0,30,10,0,0,0,1,0,0,2,0,3790,0,0,0,0,0,0,0,365,0
2012-2013,Australian Institute of Aboriginal and Torres Strait Islander Studies,TRUE,No data,"Industry, Innovation, Science, Research and Tertiary Education",TRUE,6/08/2013 13:47,FALSE,0,0,0,0,0,0,0,0,0,0,0,0,0,0,0,0,0,0,0,0,0,0,0,0
2012-2013,Australian Institute of Marine Science,TRUE,No data,"Industry, Innovation, Science, Research and Tertiary Education",TRUE,21/01/2013 16:38,FALSE,0,0,0,0,0,0,0,0,0,0,0,0,0,0,0,0,0,0,0,0,0,0,0,0
2012-2013,Australian Nuclear Science and Technology Organisation,TRUE,No data,"Industry, Innovation, Science, Research and Tertiary Education",FALSE,31/07/2013 10:25,FALSE,0,7,269,0,150,25,0,0,0,3,200,0,0,0,200,0,7480,0,0,0,4806,0,0,0
2012-2013,Australian Research Council,TRUE,No data,"Industry, Innovation, Science, Research and Tertiary Education",FALSE,3/07/2013 11:19,FALSE,0,6,0,0,29,0,0,0,0,3,0,0,0,10,500,0,0,0,0,0,0,0,0,0
2012-2013,Australian Skills Quality Authority,TRUE,No data,"Industry, Innovation, Science, Research and Tertiary Education",FALSE,7/01/2013 16:08,FALSE,0,28,547,5,49,147,0,0,0,1,0,0,0,0,300,0,10023,0,0,0,1787,0,0,0
2012-2013,Commonwealth Scientific and Industrial Research Organisation (CSIRO),TRUE,No data,"Industry, Innovation, Science, Research and Tertiary Education",FALSE,8/07/2013 17:10,FALSE,3,0,3480,0,0,2000,0,0,0,3,3,0,0,0,5051,0,0,0,0,0,0,0,0,0
2012-2013,Ctee's estab'd under Tradesmen's Rights Regulation Act 1946,TRUE,"Department of Industry, Innovation, Science, Research and Tertiary Education","Industry, Innovation, Science, Research and Tertiary Education",TRUE,19/07/2013 10:04,FALSE,0,0,0,0,0,0,0,0,0,0,0,0,0,0,0,0,0,0,0,0,0,0,0,0
2012-2013,"Dept of Industry, Innovation, Science, Research and Tertiary Education",TRUE,"Department of Industry, Innovation, Science, Research and Tertiary Education","Industry, Innovation, Science, Research and Tertiary Education",FALSE,10/07/2013 10:08,FALSE,2,5,8000,2400,2400,1300,0,0,0,1,400,0,0,0,368,0,0,0,0,0,0,0,0,0
2012-2013,Designs Office,TRUE,Designs Office,"Industry, Innovation, Science, Research and Tertiary Education",TRUE,18/07/2013 9:39,FALSE,0,0,0,0,0,0,0,0,0,0,0,0,0,0,0,0,0,0,0,0,0,0,0,0
2012-2013,Minister Assisting for Industry and Innovation,TRUE,"Department of Industry, Innovation, Science, Research and Tertiary Education","Industry, Innovation, Science, Research and Tertiary Education",TRUE,19/07/2013 10:07,FALSE,0,0,0,0,0,0,0,0,0,0,0,0,0,0,0,0,0,0,0,0,0,0,0,0
2012-2013,Minister for Industry and Innovation,TRUE,"Department of Industry, Innovation, Science, Research and Tertiary Education","Industry, Innovation, Science, Research and Tertiary Education",TRUE,19/07/2013 10:11,FALSE,0,0,0,0,0,0,0,0,0,0,0,0,0,0,0,0,0,0,0,0,0,0,0,0
2012-2013,Minister for Small Business,TRUE,"Department of Industry, Innovation, Science, Research and Tertiary Education","Industry, Innovation, Science, Research and Tertiary Education",TRUE,19/07/2013 10:13,FALSE,0,0,0,0,0,0,0,0,0,0,0,0,0,0,0,0,0,0,0,0,0,0,0,0
2012-2013,"Minister for Tertiary Education, Skills, Science and Research ",TRUE,"Department of Industry, Innovation, Science, Research and Tertiary Education","Industry, Innovation, Science, Research and Tertiary Education",TRUE,19/07/2013 10:14,FALSE,0,0,0,0,0,0,0,0,0,0,0,0,0,0,0,0,0,0,0,0,0,0,0,0
2012-2013,Parliamentary Secretary for Higher Education and Skills,TRUE,"Department of Industry, Innovation, Science, Research and Tertiary Education","Industry, Innovation, Science, Research and Tertiary Education",TRUE,19/07/2013 10:10,FALSE,0,0,0,0,0,0,0,0,0,0,0,0,0,0,0,0,0,0,0,0,0,0,0,0
2012-2013,Parliamentary Secretary for Industry and Innovation,TRUE,"Department of Industry, Innovation, Science, Research and Tertiary Education","Industry, Innovation, Science, Research and Tertiary Education",TRUE,19/07/2013 10:13,FALSE,0,0,0,0,0,0,0,0,0,0,0,0,0,0,0,0,0,0,0,0,0,0,0,0
2012-2013,Patent and Trade Marks Attorneys Disciplinary Tribunal,TRUE,Designs Office,"Industry, Innovation, Science, Research and Tertiary Education",TRUE,18/07/2013 9:52,FALSE,0,0,0,0,0,0,0,0,0,0,0,0,0,0,0,0,0,0,0,0,0,0,0,0
2012-2013,Patent Office,TRUE,Designs Office,"Industry, Innovation, Science, Research and Tertiary Education",FALSE,18/07/2013 10:17,FALSE,0,7,153,0,6,0,0,0,0,2,1,0,0,0,0,0,0,0,0,0,0,0,0,0
2012-2013,Plant Breeder's Rights Advisory Committee,TRUE,Designs Office,"Industry, Innovation, Science, Research and Tertiary Education",TRUE,18/07/2013 9:59,FALSE,0,0,0,0,0,0,0,0,0,0,0,0,0,0,0,0,0,0,0,0,0,0,0,0
2012-2013,Professional Standards Board for Patent and Trade Marks Attorneys,TRUE,Designs Office,"Industry, Innovation, Science, Research and Tertiary Education",TRUE,18/07/2013 10:03,FALSE,0,0,0,0,0,0,0,0,0,0,0,0,0,0,0,0,0,0,0,0,0,0,0,0
2012-2013,Skills Australia Board,TRUE,"Department of Industry, Innovation, Science, Research and Tertiary Education","Industry, Innovation, Science, Research and Tertiary Education",TRUE,19/07/2013 10:06,FALSE,0,0,0,0,0,0,0,0,0,0,0,0,0,0,0,0,0,0,0,0,0,0,0,0
2012-2013,The Contributions Review Panel,TRUE,"Department of Industry, Innovation, Science, Research and Tertiary Education","Industry, Innovation, Science, Research and Tertiary Education",TRUE,19/07/2013 10:04,FALSE,0,0,0,0,0,0,0,0,0,0,0,0,0,0,0,0,0,0,0,0,0,0,0,0
2012-2013,The Education Investment Fund Advisory Board ,TRUE,"Department of Industry, Innovation, Science, Research and Tertiary Education","Industry, Innovation, Science, Research and Tertiary Education",TRUE,19/07/2013 10:06,FALSE,0,0,0,0,0,0,0,0,0,0,0,0,0,0,0,0,0,0,0,0,0,0,0,0
2012-2013,Trade Marks Office,TRUE,Designs Office,"Industry, Innovation, Science, Research and Tertiary Education",FALSE,16/07/2013 9:30,FALSE,3,12,6992,0,5,0,0,0,0,5,157,0,0,0,8100,300,0,0,0,0,4450,0,0,0
2012-2013,Airservices Australia,TRUE,No data,Infrastructure and Transport,FALSE,20/06/2013 11:41,FALSE,1,3,902,74,0,40,0,0,1,2,48,0,0,0,1250,0,6000,0,0,0,150,0,0,0
2012-2013,Australian Maritime Safety Authority,TRUE,No data,Infrastructure and Transport,FALSE,2/08/2013 15:28,FALSE,0,3,450,10,5,30,0,0,0,0,3,0,0,3,870,150,0,0,0,0,0,0,0,0
2012-2013,Australian Transport Safety Bureau,TRUE,No data,Infrastructure and Transport,FALSE,1/08/2013 9:55,FALSE,1,15,1370,120,980,0,0,0,0,3,10,0,0,0,300,0,0,0,0,0,0,0,0,0
2012-2013,Civil Aviation Safety Authority,TRUE,No data,Infrastructure and Transport,FALSE,8/07/2013 10:06,FALSE,1,2,2400,0,100,150,0,0,0,1,25,0,0,0,1000,0,0,0,0,0,0,0,0,0
2012-2013,Department of Infrastructure and Transport,TRUE,Department of Infrastructure and Transport,Infrastructure and Transport,FALSE,19/10/2012 9:22,FALSE,1,2,2730,198,580,142,63,32,1,2,80,10,40,40,1500,0,0,0,0,0,0,0,0,0
2012-2013,Infrastructure Australia,TRUE,Department of Infrastructure and Transport,Infrastructure and Transport,FALSE,31/07/2013 15:19,FALSE,0,2,0,15,60,60,0,0,0,0,0,0,0,0,0,0,0,0,0,0,0,0,0,0
2012-2013,International Air Services Commission,TRUE,Department of Infrastructure and Transport,Infrastructure and Transport,TRUE,31/07/2013 15:26,FALSE,0,0,0,0,0,0,0,0,0,0,0,0,0,0,0,0,0,0,0,0,0,0,0,0
2012-2013,Marine Council,FALSE,Department of Infrastructure and Transport,Infrastructure and Transport,TRUE,31/07/2013 15:26,TRUE,0,0,0,0,0,0,0,0,0,0,0,0,0,0,0,0,0,0,0,0,0,0,0,0
2012-2013,Minister for Infrastructure and Transport,TRUE,Department of Infrastructure and Transport,Infrastructure and Transport,FALSE,31/07/2013 15:04,FALSE,0,14,0,5,5,0,0,0,0,0,0,0,0,0,0,0,0,0,0,0,0,0,0,0
2012-2013,National Transport Commission,TRUE,No data,Infrastructure and Transport,FALSE,18/07/2013 11:50,FALSE,0,3,12,0,0,0,0,0,0,0,0,0,0,0,0,0,0,0,0,0,0,0,0,0
2012-2013,Parliamentary Secretary for Infrastructure and Transport,TRUE,Department of Infrastructure and Transport,Infrastructure and Transport,TRUE,31/07/2013 15:25,FALSE,0,0,0,0,0,0,0,0,0,0,0,0,0,0,0,0,0,0,0,0,0,0,0,0
2012-2013,Australian Institute of Family Studies,TRUE,No data,Prime Minister and Cabinet,TRUE,1/07/2013 10:02,FALSE,0,0,0,0,0,0,0,0,0,0,0,0,0,0,0,0,0,0,0,0,0,0,0,0
2012-2013,Australian Public Service Commission,TRUE,Australian Public Service Commission,Prime Minister and Cabinet,FALSE,1/08/2013 9:43,FALSE,0,25,600,40,60,40,0,0,0,10,75,10,20,0,800,500,342,0,0,0,0,0,0,0
2012-2013,Cabinet Secretary,TRUE,Department of the Prime Minister and Cabinet,Prime Minister and Cabinet,TRUE,29/07/2013 10:31,FALSE,0,0,0,0,0,0,0,0,0,0,0,0,0,0,0,0,0,0,0,0,0,0,0,0
2012-2013,Commonwealth Ombudsman,TRUE,No data,Prime Minister and Cabinet,FALSE,15/07/2013 14:20,FALSE,0,5,1440,5,0,0,0,0,0,1,3,0,0,0,0,0,47614,0,0,0,8100,0,0,0
2012-2013,Defence Force Remuneration Tribunal,TRUE,No data,Prime Minister and Cabinet,TRUE,2/08/2013 16:27,FALSE,0,0,0,0,0,0,0,0,0,0,0,0,0,0,0,0,0,0,0,0,0,0,0,0
2012-2013,Department of the Prime Minister and Cabinet,TRUE,Department of the Prime Minister and Cabinet,Prime Minister and Cabinet,FALSE,3/04/2013 9:15,FALSE,8,10,9635,2280,1520,1520,120,0,0,13,0,0,36,36,0,0,0,0,9809,0,809,0,131378,0
2012-2013,Merit Protection Commissioner,TRUE,Australian Public Service Commission,Prime Minister and Cabinet,FALSE,1/08/2013 9:29,FALSE,0,12,80,10,40,20,0,0,0,0,0,0,0,0,250,0,0,0,0,0,0,0,0,0
2012-2013,Minister Assisting the Prime Minister on Asian Century Policy,TRUE,Department of the Prime Minister and Cabinet,Prime Minister and Cabinet,TRUE,29/07/2013 11:06,TRUE,0,0,0,0,0,0,0,0,0,0,0,0,0,0,0,0,0,0,0,0,0,0,0,0
2012-2013,Minister Assisting the Prime Minister on Digital Productivity,TRUE,Department of the Prime Minister and Cabinet,Prime Minister and Cabinet,TRUE,29/07/2013 11:06,TRUE,0,0,0,0,0,0,0,0,0,0,0,0,0,0,0,0,0,0,0,0,0,0,0,0
2012-2013,Minister Assisting the Prime Minister on Mental Health Reform,TRUE,Department of the Prime Minister and Cabinet,Prime Minister and Cabinet,TRUE,29/07/2013 10:40,TRUE,0,0,0,0,0,0,0,0,0,0,0,0,0,0,0,0,0,0,0,0,0,0,0,0
2012-2013,Minister Assisting the Prime Minister on the Centenary of ANZAC,TRUE,Department of the Prime Minister and Cabinet,Prime Minister and Cabinet,TRUE,29/07/2013 10:39,FALSE,0,0,0,0,0,0,0,0,0,0,0,0,0,0,0,0,0,0,0,0,0,0,0,0
2012-2013,Minister for Social Inclusion,TRUE,Department of the Prime Minister and Cabinet,Prime Minister and Cabinet,TRUE,18/10/2012 10:40,TRUE,0,0,0,0,0,0,0,0,0,0,0,0,0,0,0,0,0,0,0,0,0,0,0,0
2012-2013,Minister for the Public Service and Integrity,TRUE,Department of the Prime Minister and Cabinet,Prime Minister and Cabinet,FALSE,29/07/2013 11:05,FALSE,0,2,21,0,0,1,2,0,0,3,2,0,0,0,0,0,0,0,0,0,0,0,0,0
2012-2013,National Mental Health Commission,TRUE,No data,Prime Minister and Cabinet,FALSE,29/07/2013 10:07,FALSE,0,3,0,1,2,1,0,0,0,0,0,0,0,0,90,0,1000,0,0,0,0,0,0,0
2012-2013,Office of the Official Secretary to the Governor-General,TRUE,No data,Prime Minister and Cabinet,FALSE,31/07/2013 17:00,FALSE,0,4,5,3,0,0,0,0,0,4,1,1,0,0,0,0,0,0,0,0,0,0,0,0
2012-2013,Parliamentary Secretary to the Prime Minister,TRUE,Department of the Prime Minister and Cabinet,Prime Minister and Cabinet,TRUE,29/07/2013 10:34,FALSE,0,0,0,0,0,0,0,0,0,0,0,0,0,0,0,0,0,0,0,0,0,0,0,0
2012-2013,Prime Minister,TRUE,Department of the Prime Minister and Cabinet,Prime Minister and Cabinet,FALSE,29/07/2013 10:34,FALSE,0,14,200,0,0,0,200,0,0,0,0,0,0,0,0,0,0,0,9861,0,0,0,0,0
2012-2013,Remuneration Tribunal,TRUE,No data,Prime Minister and Cabinet,FALSE,17/07/2013 14:28,FALSE,0,1,0,0,1,1,0,0,0,0,0,0,0,0,0,0,0,0,0,0,0,0,0,0
2012-2013,Australia Council for the Arts,TRUE,No data,"Regional Australia, Local Government, Arts and Sports",FALSE,1/07/2013 10:02,FALSE,0,1,30,1,0,0,0,0,0,1,40,0,0,0,300,300,0,0,0,0,40,0,0,0
2012-2013,"Australian Film, Television and Radio School",TRUE,No data,"Regional Australia, Local Government, Arts and Sports",FALSE,12/07/2013 16:45,FALSE,0,9,8,6,15,8,1,1,0,4,2,1,1,1,20,0,10269,0,0,0,0,0,0,0
2012-2013,Australian National Maritime Museum,TRUE,No data,"Regional Australia, Local Government, Arts and Sports",TRUE,7/08/2013 13:07,FALSE,0,0,0,0,0,0,0,0,0,0,0,0,0,0,0,0,0,0,0,0,0,0,0,0
2012-2013,Australian Sports Anti-Doping Authority,TRUE,No data,"Regional Australia, Local Government, Arts and Sports",FALSE,2/08/2013 16:19,FALSE,0,12,100,5,100,30,0,0,0,0,0,0,0,0,203,0,9213,0,0,0,0,0,0,0
2012-2013,Australian Sports Commission,TRUE,No data,"Regional Australia, Local Government, Arts and Sports",FALSE,2/11/2012 9:47,FALSE,0,1,110,0,80,0,0,0,0,1,10,0,0,0,100,0,0,0,0,0,0,0,0,0
2012-2013,"Department of Regional Australia, Local Government, Arts and Sport",TRUE,"Department of Regional Australia, Local Government, Arts and Sport","Regional Australia, Local Government, Arts and Sports",FALSE,31/07/2013 16:55,FALSE,1,2,2300,15,40,20,1,0,1,1,766,0,0,0,0,0,0,0,0,0,0,0,0,0
2012-2013,Film Certification Advisory Board,TRUE,"Department of Regional Australia, Local Government, Arts and Sport","Regional Australia, Local Government, Arts and Sports",TRUE,31/07/2013 10:08,FALSE,0,0,0,0,0,0,0,0,0,0,0,0,0,0,0,0,0,0,0,0,0,0,0,0
2012-2013,"Minister for Regional Australia, Regional Development and Local Govt",TRUE,"Department of Regional Australia, Local Government, Arts and Sport","Regional Australia, Local Government, Arts and Sports",FALSE,30/07/2013 13:07,FALSE,0,1,1,1,0,0,1,0,0,0,0,0,0,0,0,0,0,0,0,0,0,0,0,0
2012-2013,Minister for Sport,TRUE,"Department of Regional Australia, Local Government, Arts and Sport","Regional Australia, Local Government, Arts and Sports",FALSE,23/05/2013 10:56,FALSE,0,1,20,4,3,0,1,3,0,0,0,0,0,0,0,0,0,0,0,0,0,0,0,0
2012-2013,Minister for the Arts,TRUE,"Department of Regional Australia, Local Government, Arts and Sport","Regional Australia, Local Government, Arts and Sports",TRUE,30/07/2013 11:54,FALSE,0,0,0,0,0,0,0,0,0,0,0,0,0,0,0,0,0,0,0,0,0,0,0,0
2012-2013,Museum of Australian Democracy,TRUE,No data,"Regional Australia, Local Government, Arts and Sports",FALSE,3/07/2013 17:36,FALSE,0,1,2,0,0,0,0,0,0,0,0,0,0,0,0,0,0,0,0,0,0,0,0,0
